<?xml version="1.0" encoding="UTF-8"?>
<Menu xmlns="http://www.example.org/menu" xmlns:xsi="http://www.w3.org/2001/XMLSchema-instance"
	xsi:schemaLocation="http://www.example.org/menu menu.xsd ">
	<Module title="用户管理">
		<Item item="tt_user_c" module="sys_manage" id="11" title="用户管理">
		</Item>
	</Module>
	<Module title="机构管理">
		<Item item="department_info_c" module="sys_manage" id="21" title="部门管理">
		</Item>
		<Item item="role_info_c" module="sys_manage" id="22" title="角色管理">
		</Item>
		<Item item="dept_c" module="sys_manage" id="23" title="院系管理">
		</Item>
		<Item item="class_c" module="sys_manage" id="24" title="班级管理">
		</Item>
	</Module>
	<Module title="信息发布">

	</Module>

</Menu>